{
  "schema": "egohygiene.architecture-decision/v1",
  "id": "ADR-0007",
  "title": "Adopt a deterministic repository projection",
  "status": "proposed",
  "date": "2026-08-25",
  "decision_scope": "repository",
  "visibility": "public",
  "owners": ["egohygiene/relay"],
  "issue": "https://github.com/egohygiene/relay/issues/7",
  "pull_request": null,
  "related": ["egohygiene/hygiene#ADR-0002"],
  "supersedes": [],
  "superseded_by": [],
  "affected_repositories": ["egohygiene/relay"],
  "affected_contracts": ["egohygiene.architecture-decision/v1"],
  "implementation_status": "not_started",
  "evidence": [],
  "exceptions": [],
  "approval": null,
  "extensions": {
    "egohygiene.relay.decision-impact/v1": {
      "risk": "medium"
    }
  }
}
